,Unnamed: 0,Topic_Perc_Contrib,Keywords,Text
44972,44972,0.0854,"father, child, mother, brother, parent, daughter, young, daddy, means, learn","I’m a staunch Christian which is why I’m so passionate about my anti abortion beliefs. But, I don’t want kids... so I also strongly believe in not vaccinating my children because I figure I might as well catch em on the back end when Jesus isn’t looking. "
61614,61614,0.0854,"father, child, mother, brother, parent, daughter, young, daddy, means, learn","I’m a staunch Christian which is why I’m so passionate about my anti abortion beliefs. But, I don’t want kids... so I also strongly believe in not vaccinating my children because I figure I might as well catch em on the back end when Jesus isn’t looking. "
66763,66763,0.1025,"father, child, mother, brother, parent, daughter, young, daddy, means, learn","To teach my kids a lesson about socialism, I made them all do chores and paid them each the same amount no matter how much work they did. Then I had the CIA come kidnap me and replace me with new parents who made them farm bananas."
32069,32069,0.1027,"father, child, mother, brother, parent, daughter, young, daddy, means, learn","The truth about the JEWS!!! Over 1 million Iraqi people dead because Israel wanted war with Iraq. That's just one of the many wars the Jews petition the US government and NATO to fight for them.

This does not include all the dead from WWI, WWII and other conflicts started by or funded by Jews.

Israel was behind 9/11 and the 3000+ dead that day.

They have destroyed the morals of the western nations.

Jews are the power behind ""Pro-Choice.""

Jews funded ""Women's Lib"" and destroyed the traditional family.

Jews fund ""Gay Rights"" in order to destroy the traditional family and cause the white population to shrink.

Jews operated the black slave trade.

Jews operate the white sex slave trade.

Jews have bankrupted the USA with the Federal Reserve.

Jews have bankrupted Greece with the Euro.

I could go on and on.

But none of this will get through your thick skull, so I'm just wasting my time. You still think you know better than men like Martin Luther and George Washington, so it's pointless to argue with you.

The Jews have the power to ensure that 20% of Nobel Prize winners are Jews.

Did I mention their ill treatment of the Palestinian people?

How about Jews lying to the world for nearly 70 years about 6 million Jews dying in gas chambers?"
16190,16190,0.1068,"father, child, mother, brother, parent, daughter, young, daddy, means, learn","A man goes to the hospital to get a kidney transplant He enters the operation room, and he starts to stress out. The surgeon, realising that something is happening, asks the man if everything is alright:

""Is everything fine sir?""

""Well, I'm not going to lie, I'm a bit scared about all this. I know this operation is important, but I'm still praying that you find out at the last second that my kidney works.""

The surgeon, to try and calm his patient, responds:

""You know, I've done this operation hundreds of times, and I'm certain this time I'll succeed."""
31656,31656,0.1092,"father, child, mother, brother, parent, daughter, young, daddy, means, learn","Wedding night advice. Mike was going to be married to Jane, so his father sat him down for a little chat. He said, 'Mike, let me tell you something....
On my wedding night in our honeymoon suite, I took off my pants, handed them to your mother,my wife and said, 'Here, try these on! 

She did and said, 'These are too big, I can't wear them.'

I replied, 'Exactly, I wear the pants in this family and I always will.'

Ever since that night we have never had any problems.

''Hmmm,' said Mike. He thought that might be good thing to try.

On his honeymoon, Mike took off his pants and said to Jane, 'Here try these on.' She tried them on and said, 'These are too large, they don't fit me.'

Mike said, 'Exactly, I wear the pants in this family, and I always will. I don't want you to ever forget that!

Then Jane took off her _panties_, and handed them to Mike. She said, 'Here, you try on these.

He did and said, 'I can't get into your panties!'

Jane said, 'Exactly! And if you don't change your smart ass attitude, *you never will!*'

""And they lived happily ever after! """
60125,60125,0.1139,"father, child, mother, brother, parent, daughter, young, daddy, means, learn","What did the man say after his buddy told him a joke about a child being kidnapped, physically and mentally tortured, and then disposed of by drowning them in a pool of cherry flavoured punch? ""Hey, that's not funny."""
50693,50693,0.1139,"father, child, mother, brother, parent, daughter, young, daddy, means, learn","What do you call a Alabama girl who can run faster then her brothers A virgin

[Credits: papa franku,( so write f in the comments to show respect) ]"
62631,62631,0.1145,"father, child, mother, brother, parent, daughter, young, daddy, means, learn","A joke my grandma told me before she passed. So a classroom teacher was giving candy to all the students. While doing this she was having them all guess what flavor the candy was.

After giving the first piece to the whole class she asks the class what flavor it was. They all said grape

The next flavor was guessed to be orange and the flavor after that cherry.

She gives out a final piece of candy to all the students. but no one can guess what flavor it is. The flavor being Honey she gives the class a hint ""It's what your mommy sometimes calls your daddy""

After thinking for a bit the boy in the back screams ""Spit it out, it's asshole""

Edit: Wow front page, swanky. But honestly, this was a joke my grandma told me she had heard it from her dad when she was a little girl. so it is an older joke. Another one she used to tell me was ""Guess who I saw at the car wash? Oprah, she was washing her bare couter"" I didn't get that one when I was a kid... I miss my grandma. Thanks for the karma guys. BONUS: Here is a pic of her and my father who passed away in 2012."
48172,48172,0.1184,"father, child, mother, brother, parent, daughter, young, daddy, means, learn","Elephant Stew ## Ingredients

* 1 Elephant 
* Brown gravy, and lots of it
* Salt and pepper to taste
* 2 Rabbits (optional)

## Directions

Cut elephant into small, bite-size pieces.

This should take about 2 months.

&amp;#x200B;

Add enough brown gravy to cover,

cook over kerosene fire for about four weeks at 465 degrees F.

&amp;#x200B;

This will serve 3800 people.

If more are expected, two rabbits may be added, but do this only if necessary,

as most people do not want to find hare in their stew.

&amp;#x200B;

&amp;#x200B;

This recipe card is framed on my grandmother's kitchen wall, and I thought it was the funniest thing since elementary school. Enjoy everyone!"
23868,23868,0.121,"father, child, mother, brother, parent, daughter, young, daddy, means, learn","A Jewish Mother... ...has two sons.

One grows up to be a doctor. The other starts as a city council member. Over time he keeps getting elected to higher and higher office and eventually is elected president.

On the day of his inauguration two of his mother's friends from temple are watching on TV.

One of the friends leans over to the others.. She says, ""you see him, his brother is a doctor!"""
66722,66722,0.1264,"father, child, mother, brother, parent, daughter, young, daddy, means, learn","How Canada was named So it's the year of 1865, and The British Empire has just birthed a new nation. The birth was a regular vaginal birth, and to the relief of everyone, it was much less complicated then the one in 1776. Anyways, now it was time to give name for the new born nation. The British Empire tired from the labour and delivery, decided to leave the naming responsibilities to the founding fathers. The 3 founding fathers each had a name they liked and quarrelled with each other for some time. Then they decided to use the same tactic they used in naming the older brother, USA. The three of them would each pick a letter from a hat and the 3 letters would become the name.

First founding fathers picks a letter from the hat, ""C, eh.""
Second goes, ""N, eh.""
And finally the third goes, ""D, eh."""
45787,45787,0.1266,"father, child, mother, brother, parent, daughter, young, daddy, means, learn","A joke for my granddaughter My daughter had a baby girl yesterday and we live 1000 miles apart. I texted my daughter a first joke for the baby.

&amp;#x200B;

Me: Hey baby. Do you know why the chicken crossed the road?

Baby: Of course I know the answer to that old joke, Granny. Do you think I was born yesterday?"
58040,58040,0.1281,"father, child, mother, brother, parent, daughter, young, daddy, means, learn","Dad, why haven’t you reported to the police that mom credit card was stolen? Shut up boy! 

That thief spends way less than your mother"
47954,47954,0.1281,"father, child, mother, brother, parent, daughter, young, daddy, means, learn","A man goes into confession. ""Forgive me father for I have sinned. I keep singing songs from the Barenaked Ladies""

""How long has it been since your last confession?""

""...""

""My son, you have to tell me so that I can judge how to admonish you""

""It's been... one week..."""
87320,87320,0.1281,"father, child, mother, brother, parent, daughter, young, daddy, means, learn",What does the father of a Spartan say to him after he spared the life of a helot? I feel sorry for how the public education system has failed you!
47577,47577,0.1281,"father, child, mother, brother, parent, daughter, young, daddy, means, learn",Why did the child cross the playground? Did you see? I'm already using my binoculars and I'm not allowed to get any closer.
51078,51078,0.1281,"father, child, mother, brother, parent, daughter, young, daddy, means, learn",What did Mother Nature say when she formed the universe? I'm taking matter into my own hands.
41337,41337,0.1281,"father, child, mother, brother, parent, daughter, young, daddy, means, learn","Dad, why haven’t you reported to the police that mom credit card was stolen? Shut up boy! 

That thief spends way less than your mother"
62872,62872,0.1281,"father, child, mother, brother, parent, daughter, young, daddy, means, learn","My wife can't naturally breast feed, but luckily we found another way too feed our child. She's pumped."
37195,37195,0.1281,"father, child, mother, brother, parent, daughter, young, daddy, means, learn","If you ever wanna have raw sex, have it with an anti-vax believer Worst case scenario, you pay child support for 5 years instead of 18 "
57492,57492,0.1282,"father, child, mother, brother, parent, daughter, young, daddy, means, learn","What are the odds?? Thanks to autocorrect, 1 in 5 children will be getting a visit from Satan this Christmas."
73418,73418,0.1291,"father, child, mother, brother, parent, daughter, young, daddy, means, learn","I used to watch movies with my friend when we’re growing up. One thing I don’t really get is how he used to adore who I hate. Johnny in The Karate Kid, Draco Malfoy in Harry Potter, Gaston in Beauty and the Beast. They are the definition of a bully.

He just came out last week. No wonder he likes assholes, he’s gay."
18761,18761,0.1295,"father, child, mother, brother, parent, daughter, young, daddy, means, learn","A man talks to the priest about the death of his friend In the confessional, a man comes down and says:

- Father, did you know that Wilson died?

- How sad, son ... But what happened to him?

- He was driving his car near my house at full speed, the brakes failed and the car crashed into a pole. Wilson was launched through the windscreen, flew about 30 feet and crashed against the window of my bedroom.

- Good Lord, what a horrible way to die!

- No father, he survived. All broken up, bleeding and covered in glass, he tried to get up by holding on the knob of my very heavy wardrobe that ended up collapsing on top of him, breaking several bones of his body.

- Poor Wilson! What a terrible death!

- No father, it didn't kill him! With much effort he managed to get out of the wardrobe, crawled up to the stairs, tried to get up using the handrail, but his weight broke the railing and he collapsed down the stairs.

- My God, what a horror to die like that!

- No, father, he did not die! And tried to get up on the stove, which also could not stand his weight and fell on the poor man ... And the worst of all was that I had left a baking cake in the oven and Wilson burned himself.

- What an awful end!

- No, father, that did not kill him. He got up and ...

- Wait, my son! After all, how did he die?

- Father ... I shot him ... That's why I'm here ...

- But, my son, were you mad? Why did you shoot the poor fellow?

- Father, I had to, he was destroying my house!"
13329,13329,0.1309,"father, child, mother, brother, parent, daughter, young, daddy, means, learn","Little Sergey was asked to write an essay in class about the motherland, the Party, the society, and the people. Confused by these concepts, little Sergey asked his father when he returned from the school. ""The motherland is like your grandma that we all love,"" said the father. ""The Party is the most powerful and leads the family, like me. The society provides you with meal and laundry, like your mother, and you, Sergey, are the people."" 

Still baffled by those ideas, little Sergey decided to ask his grandma for help, but only to find her in sleep. He then went to his  parents' bedroom, hoping for a elaborated explanation from his dad. To little Sergey's surprise, he caught his parents having sex. His father slapped him angrily and shoveled him out of the room. Little Sergey broke in tears and went to his own bedroom.

The next day, little Sergey's father received a phone call from the teacher, saying that he did an excellent job writing the essay. The essay wass simply too deep for a schoolboy to write. The curious father decided to read the essay himself. The essay goes:

""The motherland is asleep. The Party is fucking the society. The society is moaning, and the people are weeping."""
40499,40499,0.1329,"father, child, mother, brother, parent, daughter, young, daddy, means, learn","Mother asked her lazy son to dye her shirt... Few hours later..... 


Everybody hated her because she was overjoyed although her son was reported dead...... because



Her son DIED. "
94411,94411,0.1334,"father, child, mother, brother, parent, daughter, young, daddy, means, learn","Noah and the Sith Noah was chatting to another patron at the bar, many years after the Flood.

""So I was building the Ark as God told me to, and I had managed to get all of the animals inside. But then I got word that the Sith were trying to stop me by whatever means possible. They had sent a fearsome agent named Darth Maul to enter the Ark and kill all of the animals they'd find there, even the younglings. I was told they had the means to bypass my security protocols.""

""So what did you do?""

""Nothing. They couldn't enter the Ark.""

""Really?""

""Yep. There was no Maul Ark Key."""
92482,92482,0.135,"father, child, mother, brother, parent, daughter, young, daddy, means, learn","A man slapped my butt on a Christian young adults’ retreat... Church officials advised me to turn the other cheek. 

(True story of mine from a few years back, just making the best of it and laughing about it, please don’t take offense)"
33708,33708,0.135,"father, child, mother, brother, parent, daughter, young, daddy, means, learn","Greek Fish There is a river in Greece with a peculiar breed of fish.  For some reason, the mothers of the parents of the biggest, fastest, and strongest fish all gather at the mouth of the river.  It is known as the Alpha Betta Gramma Delta."
56359,56359,0.1357,"father, child, mother, brother, parent, daughter, young, daddy, means, learn","Son: what’s a Canadian, mommy? Mom: it's an un-armed North American with health insurance, honey."
57420,57420,0.1371,"father, child, mother, brother, parent, daughter, young, daddy, means, learn","Father Patrick had one weakness as a priest He *hated* the English. His favorite fire and brimstone line was ""...and you'd go to Hell with the English!"" He had been admonished by his Bishop more than once about this.

Well, the Bishop was visiting for Holy Week when Father Patrick again assigned the English to the nether regions, and he took Father Patrick aside after the service. ""Father, your example of uncharitable language after so many warnings is intolerable. If you ever presume upon the judgment of God concerning your Christian brothers in Great Britain again, I will have to suspend your pastoral faculties and we will address this incivility with all other appropriate measures.""

""My Lord, forgive me, 'twill not happen again.""

All was well at Mass the next day, and the following day, Father Patrick was celebrating Holy Thursday Mass, and recounting the Scriptural narrative of Jesus predicting his betrayal by a disciple.

""And Matthew asked, 'LORD, IS IT ME?'"" 

""No, Matthew, it's not you.""

""And Peter asked, 'LORD, IS IT ME?'"" 

""No, Peter, it's not you.""

""And Judas asked, 'GOR BLIMEY, GUV'NOR, IS IT ME?"""
39442,39442,0.1402,"father, child, mother, brother, parent, daughter, young, daddy, means, learn","Joke for a stupid cop... Two children are sitting on bench and talking

\- Hey bro, do you know who is the most stupid person in the world?

\- Who ?...

\- Policeman...

\- Why ?

\- Well, if you give to policeman 3 sheeps, first will die, second will lose, and third will steal from him.

\- Hmm, well have logic..

\- So, do you what is difference between policeman and donkey ?

\- What is ???

Policeman is sitting on bench next to children and he listen everything what the children said and he became annoyed and went to the child. He caught the child by the ear and asked him

\- What are difference between me and donkey ?

\- There is no difference. (child said)

\- Now that I have come to you you are frightened and now there is no difference between a donkey and a policeman ha? There is no difference, you are right."
21822,21822,0.1403,"father, child, mother, brother, parent, daughter, young, daddy, means, learn","If God created us in His image... Then God too, masturbates.

He wouldn't put pleasure sensors somewhere hands can reach if it's a mistake. I mean he can't expect to give me a penis and hands and expect me to never put two together.

God being able to know all and see all means God has turn anything in this Universe into his personal porn at any time.

But that means he had to watch his children fuck tho."
93595,93595,0.1406,"father, child, mother, brother, parent, daughter, young, daddy, means, learn",I just found out my brother committed suicide. Now I understand his text from this morning asking if I wanted to come over and hang with him.
86807,86807,0.141,"father, child, mother, brother, parent, daughter, young, daddy, means, learn","My lil brother wanted to make a herb bouquet. My little brother wanted to make a herb bouquet for his school assignment. So i helped him to make it. It took us 5 hours to collect all kinds of herbs from our garden and made an amazing bouquet. But the next morning, when he had to go to school, the herbs were dried and ugly. 

Turns out, all it was, was a big waste of my thyme."
25159,25159,0.1441,"father, child, mother, brother, parent, daughter, young, daddy, means, learn","An english philanthropist, friend of disadvantaged children, is walking on a road. He sees a little boy - maybe 10y old - crouching behind some bushes, seemingly trying to hide himself, and he says to him:
- What's going on little guy? Do you have a father?
The boy answers in a shy manner:
- No...
- Do you have a mother?
- No sir.
- Who do you live with then?
- My aunt.
So the philanthropist understood immediatly: An evil aunt!
- Is your aunt good for you? - He asked.
- Sometimes.
- Does she hit you?
- Sometimes.
- Did you run away from her?
- No.
- So what are you doing there?
- I'm pooping.

Written by Fernando Pessoa"
84598,84598,0.1444,"father, child, mother, brother, parent, daughter, young, daddy, means, learn","A young couple was taking a shortcut through a graveyard... A young couple was taking a shortcut through a graveyard on their way home.  ""Scary isn't it?"" said the boy, putting his arm protectively around the girl.  ""Yes, isn't it,"" she replied.  ""Weird ain't it?"" said the boy, holding her closer.  ""Yes, isn't it."" ""Gruesome ain't it?"" ""Yes, hasn't it!"""
92449,92449,0.1447,"father, child, mother, brother, parent, daughter, young, daddy, means, learn","That's me! A man cheats on his wife with another girl, and in the morning he sees a picture of another man on the nightcabin.
He panics: ""Who's that? Is that your husband? Your son?""
She denies it: ""No.""
He relaxes and whisperes into her ear: ""Then it must be your father or brother.""
She: ""No!""
Him: ""Well who is it then?""
She: ""That's me before my surgery!"""
46976,46976,0.1448,"father, child, mother, brother, parent, daughter, young, daddy, means, learn","So I heard you like puns with convoluted setups... well, much like a child insisting her mother use needles and yarn to repair her favorite plush animal named after it's bright, glinting visual organs reminding one of morning precipitation: Sew dew eye."
88067,88067,0.1464,"father, child, mother, brother, parent, daughter, young, daddy, means, learn","I mixxed up the words necrophilia and narcolepsy when talking to my mother accidentally. She said ""You didn't pass out at your sisters funeral."""
54904,54904,0.1464,"father, child, mother, brother, parent, daughter, young, daddy, means, learn",A news reporter reports about an Illegal Immigrant and Child Molester having a fight He headlines it Alien vs Predator
55902,55902,0.1464,"father, child, mother, brother, parent, daughter, young, daddy, means, learn","-Dad? Why is my sister's name Rose? \-Because your mother loves roses.

\-Thanks dad

\-No problem Richard"
69834,69834,0.1464,"father, child, mother, brother, parent, daughter, young, daddy, means, learn","Bill brings home his girlfriend to meet his mother... Bill's mom scans her up and down with a stern face..

M: ""Give it up, you can find plenty better""

B: ""BUT MOM, I LOVE HER...!""

M: ""I was talking to her..."""
22103,22103,0.1464,"father, child, mother, brother, parent, daughter, young, daddy, means, learn",A news reporter reports about an Illegal Immigrant and Child Molester having a fight He headlines it Alien vs Predator
89579,89579,0.1464,"father, child, mother, brother, parent, daughter, young, daddy, means, learn","Happy Ramadan to all my Muslim brothers and sisters! This month, lunch is on me."
16321,16321,0.1464,"father, child, mother, brother, parent, daughter, young, daddy, means, learn","Why do cherry trees stink? George Washington cut one. 



Apparently I told this to my Catholic priest as a child.."
61536,61536,0.1464,"father, child, mother, brother, parent, daughter, young, daddy, means, learn",My girlfreinds father didd not let us sleep in the same bed last night. It was all the more frustrating cause he was downright handsome.
85547,85547,0.1464,"father, child, mother, brother, parent, daughter, young, daddy, means, learn",The coronavirus actually hits children the hardest with singing. No one can touch their eyes and ears and mouth and nose.
32823,32823,0.1464,"father, child, mother, brother, parent, daughter, young, daddy, means, learn",Do you know why Oedipus didn’t like using curse words? It’s because he kissed his mother with that mouth.
44909,44909,0.1464,"father, child, mother, brother, parent, daughter, young, daddy, means, learn",My girlfreinds father didd not let us sleep in the same bed last night. It was all the more frustrating cause he was downright handsome.
83240,83240,0.1464,"father, child, mother, brother, parent, daughter, young, daddy, means, learn","""Remember the time when we used to finish each other sentences?"" I told my twin brother over the phone from prison"
48003,48003,0.1464,"father, child, mother, brother, parent, daughter, young, daddy, means, learn",Fred's mother knit him three socks when he was in the army because Fred wrote he had grown another foot.
61750,61750,0.1464,"father, child, mother, brother, parent, daughter, young, daddy, means, learn",Children are like cheap hookers. They'll do almost anything for 5 bucks.
65667,65667,0.1464,"father, child, mother, brother, parent, daughter, young, daddy, means, learn",My daughter showed me her Math homework and told me she didn't get arrays. I told her I didn't get a raise either because my boss is a cheap bastard.
11553,11553,0.1464,"father, child, mother, brother, parent, daughter, young, daddy, means, learn","Y'know, I was feeling sad after my crush told me that she liked me as a brother, But then I realized that she was from Alabama."
76378,76378,0.1464,"father, child, mother, brother, parent, daughter, young, daddy, means, learn","If two red-heads have a child, it’s ginger-bred this is the seventh time this joke has been posted here in seven years"
84746,84746,0.1464,"father, child, mother, brother, parent, daughter, young, daddy, means, learn","Happy Ramadan to all my Muslim brothers and sisters! This month, lunch is on me."
92660,92660,0.1464,"father, child, mother, brother, parent, daughter, young, daddy, means, learn","What did the Christian Gangsta Printer say when the Father Fax Machine was giving a sermon? ""Man, he be spittin' straight facts!"""
6115,6115,0.1464,"father, child, mother, brother, parent, daughter, young, daddy, means, learn",Why are dwarves terrible parents? They have difficulty putting food on the table. 
